{
  "schema_version": 1,
  "record_type": "auto_scan_config",
  "config_id": "autoscan.default.v1",
  "description": "A4's automatic scan: the detector runs about twice a second while scanning, each detection is placed by Meta's depth at five points in its box, and sightings within an object's reach join it; first values, set by reasoning, not tuned",
  "interval_s": 0.5,
  "min_score": 0.3,
  "sample_spread": 0.2,
  "max_range_m": 6.0,
  "floor_y_m": 0.0,
  "floor_margin_m": 0.15,
  "min_reach_m": 0.3,
  "reach_factor": 0.5,
  "min_frames": 2,
  "viewpoint_m": 0.5,
  "max_points_per_object": 64,
  "publish_interval_s": 3.0,
  "save_images_max": 120
}
